"id_objetosPossiveis","uri_objetosPossiveis","siglaTipo_objetosPossiveis","codTipo_objetosPossiveis","numero_objetosPossiveis","ano_objetosPossiveis","ementa_objetosPossiveis","id_proposicoesAfetadas","uri_proposicoesAfetadas","siglaTipo_proposicoesAfetadas","codTipo_proposicoesAfetadas","numero_proposicoesAfetadas","ano_proposicoesAfetadas","ementa_proposicoesAfetadas","id_votacao"
2336833,"https://dadosabertos.camara.leg.br/api/v2/proposicoes/2336833","REQ",392,1502,2022,"Requer, nos termos do artigo 155 do
Regimento Interno da Câmara dos
Deputados, que seja incluído
automaticamente na Ordem do Dia o 
Projeto de Lei nº 2.685/2022, que
 ""Institui o Programa Nacional de
Renegociação das Dívidas das Famílias
"" ReFamília e estabelece a
necessidade de imposição de limite 
aos juros cobrados na modalida de 
cartão de crédito rotativo"".",2336393,"https://dadosabertos.camara.leg.br/api/v2/proposicoes/2336393","PL",139,2685,2022,"Institui o Programa Nacional de Renegociação das Dívidas das Famílias – ReFamília e estabelece a necessidade de imposição de limite aos juros cobrados na modalidade cartão de crédito rotativo.
  NOVA EMENTA: Institui o Programa Emergencial de Renegociação de Dívidas de Pessoas Físicas Inadimplentes - Desenrola Brasil; estabelece normas para facilitação de acesso a crédito e mitigação de riscos de inadimplemento e de superendividamento de pessoas físicas; altera a Consolidação das Leis do Trabalho, aprovada pelo Decreto-Lei nº 5.452, de 1º de maio de 1943, e as Leis nºs 10.406, de 10 de janeiro de 2002 (Código Civil), 10.522, de 19 de julho de 2002 e 12.087, de 11 de novembro de 2009; e revoga dispositivo da Lei nº 4.737, de 15 de julho de 1965 (Código Eleitoral), e a Medida Provisória nº 1.176, de 5 de junho de 2023.","2336833-9"
